{"$schema":"https://json-schema.org/draft/2020-12/schema","title":"WLR wallet_entity","type":"object","required":["id","slug","canonical_name","wallet_type","status","summary","confidence","last_verified_at"],"properties":{"id":{"type":"string","pattern":"^wlr_ent_[0-9]{6}$"},"slug":{"type":"string","pattern":"^[a-z0-9]+(?:-[a-z0-9]+)*$"},"canonical_name":{"type":"string","minLength":1},"aliases":{"type":"array","items":{"type":"string"}},"wallet_type":{"enum":["hardware","software","smart_contract","mpc_threshold","hybrid","unknown"]},"status":{"enum":["active","limited","deprecated","discontinued","acquired","rebranded","dead","unknown"]},"summary":{"type":"string","minLength":1},"developer_or_company":{"type":["string","null"]},"country_or_origin":{"type":["string","null"]},"launch_date":{"type":["string","null"],"pattern":"^[0-9]{4}(?:-[0-9]{2}(?:-[0-9]{2})?)?$"},"launch_date_precision":{"enum":["day","month","year","approximate"]},"official_url":{"type":["string","null"],"format":"uri"},"official_domain":{"type":["string","null"]},"source_code_urls":{"type":"array","items":{"type":"string","format":"uri"}},"custody_model":{"enum":["self_custody","custodial","hybrid","unknown"]},"parent_entity_id":{"type":["string","null"],"pattern":"^wlr_ent_[0-9]{6}$"},"predecessor_entity_id":{"type":["string","null"],"pattern":"^wlr_ent_[0-9]{6}$"},"successor_entity_id":{"type":["string","null"],"pattern":"^wlr_ent_[0-9]{6}$"},"acquired_by_entity_id":{"type":["string","null"],"pattern":"^wlr_ent_[0-9]{6}$"},"discontinued_date":{"type":["string","null"],"pattern":"^[0-9]{4}(?:-[0-9]{2}(?:-[0-9]{2})?)?$"},"confidence":{"enum":["high","medium","low"]},"last_verified_at":{"type":"string","format":"date"},"notes":{"type":"string"},"key_management_model":{"type":["string","null"]},"system_components":{"type":"array","items":{"type":"object","required":["component_type","controlled_by","role"],"properties":{"component_type":{"type":"string"},"controlled_by":{"enum":["user","provider","shared","other","unknown"]},"role":{"type":"string"},"custody_note":{"type":"string"}},"additionalProperties":true}}},"additionalProperties":true}